
*** Running vivado
    with args -log fifo_generator_200.vds -m64 -product Vivado -mode batch -messageDb vivado.pb -notrace -source fifo_generator_200.tcl


****** Vivado v2018.3 (64-bit)
  **** SW Build 2405991 on Thu Dec  6 23:38:27 MST 2018
  **** IP Build 2404404 on Fri Dec  7 01:43:56 MST 2018
    ** Copyright 1986-2018 Xilinx, Inc. All Rights Reserved.

source fifo_generator_200.tcl -notrace
Command: synth_design -top fifo_generator_200 -part xc7a200tsbg484-2 -mode out_of_context
Starting synth_design
Attempting to get a license for feature 'Synthesis' and/or device 'xc7a200t'
INFO: [Common 17-349] Got license for feature 'Synthesis' and/or device 'xc7a200t'
INFO: Launching helper process for spawning children vivado processes
INFO: Helper process launched with PID 5528 
---------------------------------------------------------------------------------
Starting RTL Elaboration : Time (s): cpu = 00:00:06 ; elapsed = 00:00:08 . Memory (MB): peak = 423.164 ; gain = 103.410
---------------------------------------------------------------------------------
INFO: [Synth 8-638] synthesizing module 'fifo_generator_200' [d:/DATA/vivado_project/0TEST/minist_cnn/minist_cnn/minist_cnn.srcs/sources_1/ip/fifo_generator_200/synth/fifo_generator_200.vhd:73]
	Parameter C_COMMON_CLOCK bound to: 1 - type: integer 
	Parameter C_SELECT_XPM bound to: 0 - type: integer 
	Parameter C_COUNT_TYPE bound to: 0 - type: integer 
	Parameter C_DATA_COUNT_WIDTH bound to: 8 - type: integer 
	Parameter C_DEFAULT_VALUE bound to: BlankString - type: string 
	Parameter C_DIN_WIDTH bound to: 32 - type: integer 
	Parameter C_DOUT_RST_VAL bound to: 0 - type: string 
	Parameter C_DOUT_WIDTH bound to: 32 - type: integer 
	Parameter C_ENABLE_RLOCS bound to: 0 - type: integer 
	Parameter C_FAMILY bound to: artix7 - type: string 
	Parameter C_FULL_FLAGS_RST_VAL bound to: 0 - type: integer 
	Parameter C_HAS_ALMOST_EMPTY bound to: 0 - type: integer 
	Parameter C_HAS_ALMOST_FULL bound to: 0 - type: integer 
	Parameter C_HAS_BACKUP bound to: 0 - type: integer 
	Parameter C_HAS_DATA_COUNT bound to: 0 - type: integer 
	Parameter C_HAS_INT_CLK bound to: 0 - type: integer 
	Parameter C_HAS_MEMINIT_FILE bound to: 0 - type: integer 
	Parameter C_HAS_OVERFLOW bound to: 0 - type: integer 
	Parameter C_HAS_RD_DATA_COUNT bound to: 0 - type: integer 
	Parameter C_HAS_RD_RST bound to: 0 - type: integer 
	Parameter C_HAS_RST bound to: 0 - type: integer 
	Parameter C_HAS_SRST bound to: 1 - type: integer 
	Parameter C_HAS_UNDERFLOW bound to: 0 - type: integer 
	Parameter C_HAS_VALID bound to: 0 - type: integer 
	Parameter C_HAS_WR_ACK bound to: 0 - type: integer 
	Parameter C_HAS_WR_DATA_COUNT bound to: 0 - type: integer 
	Parameter C_HAS_WR_RST bound to: 0 - type: integer 
	Parameter C_IMPLEMENTATION_TYPE bound to: 0 - type: integer 
	Parameter C_INIT_WR_PNTR_VAL bound to: 0 - type: integer 
	Parameter C_MEMORY_TYPE bound to: 1 - type: integer 
	Parameter C_MIF_FILE_NAME bound to: BlankString - type: string 
	Parameter C_OPTIMIZATION_MODE bound to: 0 - type: integer 
	Parameter C_OVERFLOW_LOW bound to: 0 - type: integer 
	Parameter C_PRELOAD_LATENCY bound to: 1 - type: integer 
	Parameter C_PRELOAD_REGS bound to: 0 - type: integer 
	Parameter C_PRIM_FIFO_TYPE bound to: 512x36 - type: string 
	Parameter C_PROG_EMPTY_THRESH_ASSERT_VAL bound to: 2 - type: integer 
	Parameter C_PROG_EMPTY_THRESH_NEGATE_VAL bound to: 3 - type: integer 
	Parameter C_PROG_EMPTY_TYPE bound to: 0 - type: integer 
	Parameter C_PROG_FULL_THRESH_ASSERT_VAL bound to: 254 - type: integer 
	Parameter C_PROG_FULL_THRESH_NEGATE_VAL bound to: 253 - type: integer 
	Parameter C_PROG_FULL_TYPE bound to: 1 - type: integer 
	Parameter C_RD_DATA_COUNT_WIDTH bound to: 8 - type: integer 
	Parameter C_RD_DEPTH bound to: 256 - type: integer 
	Parameter C_RD_FREQ bound to: 1 - type: integer 
	Parameter C_RD_PNTR_WIDTH bound to: 8 - type: integer 
	Parameter C_UNDERFLOW_LOW bound to: 0 - type: integer 
	Parameter C_USE_DOUT_RST bound to: 1 - type: integer 
	Parameter C_USE_ECC bound to: 0 - type: integer 
	Parameter C_USE_EMBEDDED_REG bound to: 0 - type: integer 
	Parameter C_USE_PIPELINE_REG bound to: 0 - type: integer 
	Parameter C_POWER_SAVING_MODE bound to: 0 - type: integer 
	Parameter C_USE_FIFO16_FLAGS bound to: 0 - type: integer 
	Parameter C_USE_FWFT_DATA_COUNT bound to: 0 - type: integer 
	Parameter C_VALID_LOW bound to: 0 - type: integer 
	Parameter C_WR_ACK_LOW bound to: 0 - type: integer 
	Parameter C_WR_DATA_COUNT_WIDTH bound to: 8 - type: integer 
	Parameter C_WR_DEPTH bound to: 256 - type: integer 
	Parameter C_WR_FREQ bound to: 1 - type: integer 
	Parameter C_WR_PNTR_WIDTH bound to: 8 - type: integer 
	Parameter C_WR_RESPONSE_LATENCY bound to: 1 - type: integer 
	Parameter C_MSGON_VAL bound to: 1 - type: integer 
	Parameter C_ENABLE_RST_SYNC bound to: 1 - type: integer 
	Parameter C_EN_SAFETY_CKT bound to: 0 - type: integer 
	Parameter C_ERROR_INJECTION_TYPE bound to: 0 - type: integer 
	Parameter C_SYNCHRONIZER_STAGE bound to: 2 - type: integer 
	Parameter C_INTERFACE_TYPE bound to: 0 - type: integer 
	Parameter C_AXI_TYPE bound to: 1 - type: integer 
	Parameter C_HAS_AXI_WR_CHANNEL bound to: 1 - type: integer 
	Parameter C_HAS_AXI_RD_CHANNEL bound to: 1 - type: integer 
	Parameter C_HAS_SLAVE_CE bound to: 0 - type: integer 
	Parameter C_HAS_MASTER_CE bound to: 0 - type: integer 
	Parameter C_ADD_NGC_CONSTRAINT bound to: 0 - type: integer 
	Parameter C_USE_COMMON_OVERFLOW bound to: 0 - type: integer 
	Parameter C_USE_COMMON_UNDERFLOW bound to: 0 - type: integer 
	Parameter C_USE_DEFAULT_SETTINGS bound to: 0 - type: integer 
	Parameter C_AXI_ID_WIDTH bound to: 1 - type: integer 
	Parameter C_AXI_ADDR_WIDTH bound to: 32 - type: integer 
	Parameter C_AXI_DATA_WIDTH bound to: 64 - type: integer 
	Parameter C_AXI_LEN_WIDTH bound to: 8 - type: integer 
	Parameter C_AXI_LOCK_WIDTH bound to: 1 - type: integer 
	Parameter C_HAS_AXI_ID bound to: 0 - type: integer 
	Parameter C_HAS_AXI_AWUSER bound to: 0 - type: integer 
	Parameter C_HAS_AXI_WUSER bound to: 0 - type: integer 
	Parameter C_HAS_AXI_BUSER bound to: 0 - type: integer 
	Parameter C_HAS_AXI_ARUSER bound to: 0 - type: integer 
	Parameter C_HAS_AXI_RUSER bound to: 0 - type: integer 
	Parameter C_AXI_ARUSER_WIDTH bound to: 1 - type: integer 
	Parameter C_AXI_AWUSER_WIDTH bound to: 1 - type: integer 
	Parameter C_AXI_WUSER_WIDTH bound to: 1 - type: integer 
	Parameter C_AXI_BUSER_WIDTH bound to: 1 - type: integer 
	Parameter C_AXI_RUSER_WIDTH bound to: 1 - type: integer 
	Parameter C_HAS_AXIS_TDATA bound to: 1 - type: integer 
	Parameter C_HAS_AXIS_TID bound to: 0 - type: integer 
	Parameter C_HAS_AXIS_TDEST bound to: 0 - type: integer 
	Parameter C_HAS_AXIS_TUSER bound to: 1 - type: integer 
	Parameter C_HAS_AXIS_TREADY bound to: 1 - type: integer 
	Parameter C_HAS_AXIS_TLAST bound to: 0 - type: integer 
	Parameter C_HAS_AXIS_TSTRB bound to: 0 - type: integer 
	Parameter C_HAS_AXIS_TKEEP bound to: 0 - type: integer 
	Parameter C_AXIS_TDATA_WIDTH bound to: 8 - type: integer 
	Parameter C_AXIS_TID_WIDTH bound to: 1 - type: integer 
	Parameter C_AXIS_TDEST_WIDTH bound to: 1 - type: integer 
	Parameter C_AXIS_TUSER_WIDTH bound to: 4 - type: integer 
	Parameter C_AXIS_TSTRB_WIDTH bound to: 1 - type: integer 
	Parameter C_AXIS_TKEEP_WIDTH bound to: 1 - type: integer 
	Parameter C_WACH_TYPE bound to: 0 - type: integer 
	Parameter C_WDCH_TYPE bound to: 0 - type: integer 
	Parameter C_WRCH_TYPE bound to: 0 - type: integer 
	Parameter C_RACH_TYPE bound to: 0 - type: integer 
	Parameter C_RDCH_TYPE bound to: 0 - type: integer 
	Parameter C_AXIS_TYPE bound to: 0 - type: integer 
	Parameter C_IMPLEMENTATION_TYPE_WACH bound to: 2 - type: integer 
	Parameter C_IMPLEMENTATION_TYPE_WDCH bound to: 1 - type: integer 
	Parameter C_IMPLEMENTATION_TYPE_WRCH bound to: 2 - type: integer 
	Parameter C_IMPLEMENTATION_TYPE_RACH bound to: 2 - type: integer 
	Parameter C_IMPLEMENTATION_TYPE_RDCH bound to: 1 - type: integer 
	Parameter C_IMPLEMENTATION_TYPE_AXIS bound to: 1 - type: integer 
	Parameter C_APPLICATION_TYPE_WACH bound to: 0 - type: integer 
	Parameter C_APPLICATION_TYPE_WDCH bound to: 0 - type: integer 
	Parameter C_APPLICATION_TYPE_WRCH bound to: 0 - type: integer 
	Parameter C_APPLICATION_TYPE_RACH bound to: 0 - type: integer 
	Parameter C_APPLICATION_TYPE_RDCH bound to: 0 - type: integer 
	Parameter C_APPLICATION_TYPE_AXIS bound to: 0 - type: integer 
	Parameter C_PRIM_FIFO_TYPE_WACH bound to: 512x36 - type: string 
	Parameter C_PRIM_FIFO_TYPE_WDCH bound to: 1kx36 - type: string 
	Parameter C_PRIM_FIFO_TYPE_WRCH bound to: 512x36 - type: string 
	Parameter C_PRIM_FIFO_TYPE_RACH bound to: 512x36 - type: string 
	Parameter C_PRIM_FIFO_TYPE_RDCH bound to: 1kx36 - type: string 
	Parameter C_PRIM_FIFO_TYPE_AXIS bound to: 1kx18 - type: string 
	Parameter C_USE_ECC_WACH bound to: 0 - type: integer 
	Parameter C_USE_ECC_WDCH bound to: 0 - type: integer 
	Parameter C_USE_ECC_WRCH bound to: 0 - type: integer 
	Parameter C_USE_ECC_RACH bound to: 0 - type: integer 
	Parameter C_USE_ECC_RDCH bound to: 0 - type: integer 
	Parameter C_USE_ECC_AXIS bound to: 0 - type: integer 
	Parameter C_ERROR_INJECTION_TYPE_WACH bound to: 0 - type: integer 
	Parameter C_ERROR_INJECTION_TYPE_WDCH bound to: 0 - type: integer 
	Parameter C_ERROR_INJECTION_TYPE_WRCH bound to: 0 - type: integer 
	Parameter C_ERROR_INJECTION_TYPE_RACH bound to: 0 - type: integer 
	Parameter C_ERROR_INJECTION_TYPE_RDCH bound to: 0 - type: integer 
	Parameter C_ERROR_INJECTION_TYPE_AXIS bound to: 0 - type: integer 
	Parameter C_DIN_WIDTH_WACH bound to: 1 - type: integer 
	Parameter C_DIN_WIDTH_WDCH bound to: 64 - type: integer 
	Parameter C_DIN_WIDTH_WRCH bound to: 2 - type: integer 
	Parameter C_DIN_WIDTH_RACH bound to: 32 - type: integer 
	Parameter C_DIN_WIDTH_RDCH bound to: 64 - type: integer 
	Parameter C_DIN_WIDTH_AXIS bound to: 1 - type: integer 
	Parameter C_WR_DEPTH_WACH bound to: 16 - type: integer 
	Parameter C_WR_DEPTH_WDCH bound to: 1024 - type: integer 
	Parameter C_WR_DEPTH_WRCH bound to: 16 - type: integer 
	Parameter C_WR_DEPTH_RACH bound to: 16 - type: integer 
	Parameter C_WR_DEPTH_RDCH bound to: 1024 - type: integer 
	Parameter C_WR_DEPTH_AXIS bound to: 1024 - type: integer 
	Parameter C_WR_PNTR_WIDTH_WACH bound to: 4 - type: integer 
	Parameter C_WR_PNTR_WIDTH_WDCH bound to: 10 - type: integer 
	Parameter C_WR_PNTR_WIDTH_WRCH bound to: 4 - type: integer 
	Parameter C_WR_PNTR_WIDTH_RACH bound to: 4 - type: integer 
	Parameter C_WR_PNTR_WIDTH_RDCH bound to: 10 - type: integer 
	Parameter C_WR_PNTR_WIDTH_AXIS bound to: 10 - type: integer 
	Parameter C_HAS_DATA_COUNTS_WACH bound to: 0 - type: integer 
	Parameter C_HAS_DATA_COUNTS_WDCH bound to: 0 - type: integer 
	Parameter C_HAS_DATA_COUNTS_WRCH bound to: 0 - type: integer 
	Parameter C_HAS_DATA_COUNTS_RACH bound to: 0 - type: integer 
	Parameter C_HAS_DATA_COUNTS_RDCH bound to: 0 - type: integer 
	Parameter C_HAS_DATA_COUNTS_AXIS bound to: 0 - type: integer 
	Parameter C_HAS_PROG_FLAGS_WACH bound to: 0 - type: integer 
	Parameter C_HAS_PROG_FLAGS_WDCH bound to: 0 - type: integer 
	Parameter C_HAS_PROG_FLAGS_WRCH bound to: 0 - type: integer 
	Parameter C_HAS_PROG_FLAGS_RACH bound to: 0 - type: integer 
	Parameter C_HAS_PROG_FLAGS_RDCH bound to: 0 - type: integer 
	Parameter C_HAS_PROG_FLAGS_AXIS bound to: 0 - type: integer 
	Parameter C_PROG_FULL_TYPE_WACH bound to: 0 - type: integer 
	Parameter C_PROG_FULL_TYPE_WDCH bound to: 0 - type: integer 
	Parameter C_PROG_FULL_TYPE_WRCH bound to: 0 - type: integer 
	Parameter C_PROG_FULL_TYPE_RACH bound to: 0 - type: integer 
	Parameter C_PROG_FULL_TYPE_RDCH bound to: 0 - type: integer 
	Parameter C_PROG_FULL_TYPE_AXIS bound to: 0 - type: integer 
	Parameter C_PROG_FULL_THRESH_ASSERT_VAL_WACH bound to: 1023 - type: integer 
	Parameter C_PROG_FULL_THRESH_ASSERT_VAL_WDCH bound to: 1023 - type: integer 
	Parameter C_PROG_FULL_THRESH_ASSERT_VAL_WRCH bound to: 1023 - type: integer 
	Parameter C_PROG_FULL_THRESH_ASSERT_VAL_RACH bound to: 1023 - type: integer 
	Parameter C_PROG_FULL_THRESH_ASSERT_VAL_RDCH bound to: 1023 - type: integer 
	Parameter C_PROG_FULL_THRESH_ASSERT_VAL_AXIS bound to: 1023 - type: integer 
	Parameter C_PROG_EMPTY_TYPE_WACH bound to: 0 - type: integer 
	Parameter C_PROG_EMPTY_TYPE_WDCH bound to: 0 - type: integer 
	Parameter C_PROG_EMPTY_TYPE_WRCH bound to: 0 - type: integer 
	Parameter C_PROG_EMPTY_TYPE_RACH bound to: 0 - type: integer 
	Parameter C_PROG_EMPTY_TYPE_RDCH bound to: 0 - type: integer 
	Parameter C_PROG_EMPTY_TYPE_AXIS bound to: 0 - type: integer 
	Parameter C_PROG_EMPTY_THRESH_ASSERT_VAL_WACH bound to: 1022 - type: integer 
	Parameter C_PROG_EMPTY_THRESH_ASSERT_VAL_WDCH bound to: 1022 - type: integer 
	Parameter C_PROG_EMPTY_THRESH_ASSERT_VAL_WRCH bound to: 1022 - type: integer 
	Parameter C_PROG_EMPTY_THRESH_ASSERT_VAL_RACH bound to: 1022 - type: integer 
	Parameter C_PROG_EMPTY_THRESH_ASSERT_VAL_RDCH bound to: 1022 - type: integer 
	Parameter C_PROG_EMPTY_THRESH_ASSERT_VAL_AXIS bound to: 1022 - type: integer 
	Parameter C_REG_SLICE_MODE_WACH bound to: 0 - type: integer 
	Parameter C_REG_SLICE_MODE_WDCH bound to: 0 - type: integer 
	Parameter C_REG_SLICE_MODE_WRCH bound to: 0 - type: integer 
	Parameter C_REG_SLICE_MODE_RACH bound to: 0 - type: integer 
	Parameter C_REG_SLICE_MODE_RDCH bound to: 0 - type: integer 
	Parameter C_REG_SLICE_MODE_AXIS bound to: 0 - type: integer 
INFO: [Synth 8-3491] module 'fifo_generator_v13_2_3' declared at 'd:/DATA/vivado_project/0TEST/minist_cnn/minist_cnn/minist_cnn.srcs/sources_1/ip/fifo_generator_200/hdl/fifo_generator_v13_2_vhsyn_rfs.vhd:38578' bound to instance 'U0' of component 'fifo_generator_v13_2_3' [d:/DATA/vivado_project/0TEST/minist_cnn/minist_cnn/minist_cnn.srcs/sources_1/ip/fifo_generator_200/synth/fifo_generator_200.vhd:541]
INFO: [Synth 8-256] done synthesizing module 'fifo_generator_200' (25#1) [d:/DATA/vivado_project/0TEST/minist_cnn/minist_cnn/minist_cnn.srcs/sources_1/ip/fifo_generator_200/synth/fifo_generator_200.vhd:73]
WARNING: [Synth 8-3331] design wr_pf_ss has unconnected port PROG_FULL_THRESH[7]
WARNING: [Synth 8-3331] design wr_pf_ss has unconnected port PROG_FULL_THRESH[6]
WARNING: [Synth 8-3331] design wr_pf_ss has unconnected port PROG_FULL_THRESH[5]
WARNING: [Synth 8-3331] design wr_pf_ss has unconnected port PROG_FULL_THRESH[4]
WARNING: [Synth 8-3331] design wr_pf_ss has unconnected port PROG_FULL_THRESH[3]
WARNING: [Synth 8-3331] design wr_pf_ss has unconnected port PROG_FULL_THRESH[2]
WARNING: [Synth 8-3331] design wr_pf_ss has unconnected port PROG_FULL_THRESH[1]
WARNING: [Synth 8-3331] design wr_pf_ss has unconnected port PROG_FULL_THRESH[0]
WARNING: [Synth 8-3331] design wr_pf_ss has unconnected port PROG_FULL_THRESH_ASSERT[7]
WARNING: [Synth 8-3331] design wr_pf_ss has unconnected port PROG_FULL_THRESH_ASSERT[6]
WARNING: [Synth 8-3331] design wr_pf_ss has unconnected port PROG_FULL_THRESH_ASSERT[5]
WARNING: [Synth 8-3331] design wr_pf_ss has unconnected port PROG_FULL_THRESH_ASSERT[4]
WARNING: [Synth 8-3331] design wr_pf_ss has unconnected port PROG_FULL_THRESH_ASSERT[3]
WARNING: [Synth 8-3331] design wr_pf_ss has unconnected port PROG_FULL_THRESH_ASSERT[2]
WARNING: [Synth 8-3331] design wr_pf_ss has unconnected port PROG_FULL_THRESH_ASSERT[1]
WARNING: [Synth 8-3331] design wr_pf_ss has unconnected port PROG_FULL_THRESH_ASSERT[0]
WARNING: [Synth 8-3331] design wr_pf_ss has unconnected port PROG_FULL_THRESH_NEGATE[7]
WARNING: [Synth 8-3331] design wr_pf_ss has unconnected port PROG_FULL_THRESH_NEGATE[6]
WARNING: [Synth 8-3331] design wr_pf_ss has unconnected port PROG_FULL_THRESH_NEGATE[5]
WARNING: [Synth 8-3331] design wr_pf_ss has unconnected port PROG_FULL_THRESH_NEGATE[4]
WARNING: [Synth 8-3331] design wr_pf_ss has unconnected port PROG_FULL_THRESH_NEGATE[3]
WARNING: [Synth 8-3331] design wr_pf_ss has unconnected port PROG_FULL_THRESH_NEGATE[2]
WARNING: [Synth 8-3331] design wr_pf_ss has unconnected port PROG_FULL_THRESH_NEGATE[1]
WARNING: [Synth 8-3331] design wr_pf_ss has unconnected port PROG_FULL_THRESH_NEGATE[0]
WARNING: [Synth 8-3331] design wr_pf_ss has unconnected port WR_RST
WARNING: [Synth 8-3331] design wr_pf_ss has unconnected port RST_FULL_FF
WARNING: [Synth 8-3331] design wr_pf_ss has unconnected port FULL
WARNING: [Synth 8-3331] design wr_pf_ss has unconnected port EMPTY
WARNING: [Synth 8-3331] design wr_pf_ss has unconnected port RAM_ALMOST_FULL
WARNING: [Synth 8-3331] design wr_pf_ss has unconnected port RAM_ALMOST_EMPTY
WARNING: [Synth 8-3331] design wr_pf_ss has unconnected port WR_PNTR[7]
WARNING: [Synth 8-3331] design wr_pf_ss has unconnected port WR_PNTR[6]
WARNING: [Synth 8-3331] design wr_pf_ss has unconnected port WR_PNTR[5]
WARNING: [Synth 8-3331] design wr_pf_ss has unconnected port WR_PNTR[4]
WARNING: [Synth 8-3331] design wr_pf_ss has unconnected port WR_PNTR[3]
WARNING: [Synth 8-3331] design wr_pf_ss has unconnected port WR_PNTR[2]
WARNING: [Synth 8-3331] design wr_pf_ss has unconnected port WR_PNTR[1]
WARNING: [Synth 8-3331] design wr_pf_ss has unconnected port WR_PNTR[0]
WARNING: [Synth 8-3331] design wr_status_flags_ss has unconnected port RST_FULL_FF
WARNING: [Synth 8-3331] design wr_status_flags_ss has unconnected port WR_RST
WARNING: [Synth 8-3331] design wr_status_flags_ss has unconnected port SRST
WARNING: [Synth 8-3331] design wr_status_flags_ss has unconnected port SAFETY_CKT_WR_RST
WARNING: [Synth 8-3331] design wr_status_flags_ss has unconnected port WR_PNTR_PLUS2[7]
WARNING: [Synth 8-3331] design wr_status_flags_ss has unconnected port WR_PNTR_PLUS2[6]
WARNING: [Synth 8-3331] design wr_status_flags_ss has unconnected port WR_PNTR_PLUS2[5]
WARNING: [Synth 8-3331] design wr_status_flags_ss has unconnected port WR_PNTR_PLUS2[4]
WARNING: [Synth 8-3331] design wr_status_flags_ss has unconnected port WR_PNTR_PLUS2[3]
WARNING: [Synth 8-3331] design wr_status_flags_ss has unconnected port WR_PNTR_PLUS2[2]
WARNING: [Synth 8-3331] design wr_status_flags_ss has unconnected port WR_PNTR_PLUS2[1]
WARNING: [Synth 8-3331] design wr_status_flags_ss has unconnected port WR_PNTR_PLUS2[0]
WARNING: [Synth 8-3331] design wr_status_flags_ss has unconnected port WR_PNTR_PLUS3[7]
WARNING: [Synth 8-3331] design wr_status_flags_ss has unconnected port WR_PNTR_PLUS3[6]
WARNING: [Synth 8-3331] design wr_status_flags_ss has unconnected port WR_PNTR_PLUS3[5]
WARNING: [Synth 8-3331] design wr_status_flags_ss has unconnected port WR_PNTR_PLUS3[4]
WARNING: [Synth 8-3331] design wr_status_flags_ss has unconnected port WR_PNTR_PLUS3[3]
WARNING: [Synth 8-3331] design wr_status_flags_ss has unconnected port WR_PNTR_PLUS3[2]
WARNING: [Synth 8-3331] design wr_status_flags_ss has unconnected port WR_PNTR_PLUS3[1]
WARNING: [Synth 8-3331] design wr_status_flags_ss has unconnected port WR_PNTR_PLUS3[0]
WARNING: [Synth 8-3331] design wr_bin_cntr has unconnected port RST
WARNING: [Synth 8-3331] design wr_logic has unconnected port WR_EN_INTO_LOGIC
WARNING: [Synth 8-3331] design wr_logic has unconnected port WR_RST_INTO_LOGIC
WARNING: [Synth 8-3331] design wr_logic has unconnected port RD_EN
WARNING: [Synth 8-3331] design wr_logic has unconnected port WR_RST_BUSY
WARNING: [Synth 8-3331] design rd_status_flags_ss has unconnected port RD_RST
WARNING: [Synth 8-3331] design rd_status_flags_ss has unconnected port SAFETY_CKT_RD_RST
WARNING: [Synth 8-3331] design rd_status_flags_ss has unconnected port RD_PNTR_PLUS2[7]
WARNING: [Synth 8-3331] design rd_status_flags_ss has unconnected port RD_PNTR_PLUS2[6]
WARNING: [Synth 8-3331] design rd_status_flags_ss has unconnected port RD_PNTR_PLUS2[5]
WARNING: [Synth 8-3331] design rd_status_flags_ss has unconnected port RD_PNTR_PLUS2[4]
WARNING: [Synth 8-3331] design rd_status_flags_ss has unconnected port RD_PNTR_PLUS2[3]
WARNING: [Synth 8-3331] design rd_status_flags_ss has unconnected port RD_PNTR_PLUS2[2]
WARNING: [Synth 8-3331] design rd_status_flags_ss has unconnected port RD_PNTR_PLUS2[1]
WARNING: [Synth 8-3331] design rd_status_flags_ss has unconnected port RD_PNTR_PLUS2[0]
WARNING: [Synth 8-3331] design rd_bin_cntr has unconnected port RST
WARNING: [Synth 8-3331] design rd_logic has unconnected port RD_EN_INTO_LOGIC
WARNING: [Synth 8-3331] design rd_logic has unconnected port RD_RST_INTO_LOGIC
WARNING: [Synth 8-3331] design rd_logic has unconnected port RD_RST_BUSY
WARNING: [Synth 8-3331] design rd_logic has unconnected port RST_FULL_FF
WARNING: [Synth 8-3331] design rd_logic has unconnected port ALMOST_FULL_FB
WARNING: [Synth 8-3331] design rd_logic has unconnected port FULL
WARNING: [Synth 8-3331] design rd_logic has unconnected port WR_PNTR_PLUS1_RD[7]
WARNING: [Synth 8-3331] design rd_logic has unconnected port WR_PNTR_PLUS1_RD[6]
WARNING: [Synth 8-3331] design rd_logic has unconnected port WR_PNTR_PLUS1_RD[5]
WARNING: [Synth 8-3331] design rd_logic has unconnected port WR_PNTR_PLUS1_RD[4]
WARNING: [Synth 8-3331] design rd_logic has unconnected port WR_PNTR_PLUS1_RD[3]
WARNING: [Synth 8-3331] design rd_logic has unconnected port WR_PNTR_PLUS1_RD[2]
WARNING: [Synth 8-3331] design rd_logic has unconnected port WR_PNTR_PLUS1_RD[1]
WARNING: [Synth 8-3331] design rd_logic has unconnected port WR_PNTR_PLUS1_RD[0]
WARNING: [Synth 8-3331] design rd_logic has unconnected port PROG_EMPTY_THRESH[7]
WARNING: [Synth 8-3331] design rd_logic has unconnected port PROG_EMPTY_THRESH[6]
WARNING: [Synth 8-3331] design rd_logic has unconnected port PROG_EMPTY_THRESH[5]
WARNING: [Synth 8-3331] design rd_logic has unconnected port PROG_EMPTY_THRESH[4]
WARNING: [Synth 8-3331] design rd_logic has unconnected port PROG_EMPTY_THRESH[3]
WARNING: [Synth 8-3331] design rd_logic has unconnected port PROG_EMPTY_THRESH[2]
WARNING: [Synth 8-3331] design rd_logic has unconnected port PROG_EMPTY_THRESH[1]
WARNING: [Synth 8-3331] design rd_logic has unconnected port PROG_EMPTY_THRESH[0]
WARNING: [Synth 8-3331] design rd_logic has unconnected port PROG_EMPTY_THRESH_ASSERT[7]
WARNING: [Synth 8-3331] design rd_logic has unconnected port PROG_EMPTY_THRESH_ASSERT[6]
WARNING: [Synth 8-3331] design rd_logic has unconnected port PROG_EMPTY_THRESH_ASSERT[5]
WARNING: [Synth 8-3331] design rd_logic has unconnected port PROG_EMPTY_THRESH_ASSERT[4]
INFO: [Common 17-14] Message 'Synth 8-3331' appears 100 times and further instances of the messages will be disabled. Use the Tcl command set_msg_config to change the current settings.
---------------------------------------------------------------------------------
Finished RTL Elaboration : Time (s): cpu = 00:01:01 ; elapsed = 00:01:03 . Memory (MB): peak = 704.953 ; gain = 385.199
---------------------------------------------------------------------------------

Report Check Netlist: 
+------+------------------+-------+---------+-------+------------------+
|      |Item              |Errors |Warnings |Status |Description       |
+------+------------------+-------+---------+-------+------------------+
|1     |multi_driven_nets |      0|        0|Passed |Multi driven nets |
+------+------------------+-------+---------+-------+------------------+
---------------------------------------------------------------------------------
Start Handling Custom Attributes
---------------------------------------------------------------------------------
---------------------------------------------------------------------------------
Finished Handling Custom Attributes : Time (s): cpu = 00:01:01 ; elapsed = 00:01:04 . Memory (MB): peak = 704.953 ; gain = 385.199
---------------------------------------------------------------------------------
---------------------------------------------------------------------------------
Finished RTL Optimization Phase 1 : Time (s): cpu = 00:01:01 ; elapsed = 00:01:04 . Memory (MB): peak = 704.953 ; gain = 385.199
---------------------------------------------------------------------------------
INFO: [Netlist 29-17] Analyzing 1 Unisim elements for replacement
INFO: [Netlist 29-28] Unisim Transformation completed in 0 CPU seconds
INFO: [Device 21-403] Loading part xc7a200tsbg484-2
INFO: [Project 1-570] Preparing netlist for logic optimization

Processing XDC Constraints
Initializing timing engine
Parsing XDC File [d:/DATA/vivado_project/0TEST/minist_cnn/minist_cnn/minist_cnn.srcs/sources_1/ip/fifo_generator_200/fifo_generator_200_ooc.xdc] for cell 'U0'
Finished Parsing XDC File [d:/DATA/vivado_project/0TEST/minist_cnn/minist_cnn/minist_cnn.srcs/sources_1/ip/fifo_generator_200/fifo_generator_200_ooc.xdc] for cell 'U0'
Parsing XDC File [d:/DATA/vivado_project/0TEST/minist_cnn/minist_cnn/minist_cnn.srcs/sources_1/ip/fifo_generator_200/fifo_generator_200.xdc] for cell 'U0'
Finished Parsing XDC File [d:/DATA/vivado_project/0TEST/minist_cnn/minist_cnn/minist_cnn.srcs/sources_1/ip/fifo_generator_200/fifo_generator_200.xdc] for cell 'U0'
Parsing XDC File [D:/DATA/vivado_project/0TEST/minist_cnn/minist_cnn/minist_cnn.runs/fifo_generator_200_synth_1/dont_touch.xdc]
Finished Parsing XDC File [D:/DATA/vivado_project/0TEST/minist_cnn/minist_cnn/minist_cnn.runs/fifo_generator_200_synth_1/dont_touch.xdc]
Completed Processing XDC Constraints

Netlist sorting complete. Time (s): cpu = 00:00:00 ; elapsed = 00:00:00 . Memory (MB): peak = 845.859 ; gain = 0.000
INFO: [Project 1-111] Unisim Transformation Summary:
No Unisim elements were transformed.

Netlist sorting complete. Time (s): cpu = 00:00:00 ; elapsed = 00:00:00 . Memory (MB): peak = 845.859 ; gain = 0.000
Constraint Validation Runtime : Time (s): cpu = 00:00:00 ; elapsed = 00:00:00.033 . Memory (MB): peak = 847.211 ; gain = 1.352
---------------------------------------------------------------------------------
Finished Constraint Validation : Time (s): cpu = 00:01:12 ; elapsed = 00:01:16 . Memory (MB): peak = 847.211 ; gain = 527.457
---------------------------------------------------------------------------------
---------------------------------------------------------------------------------
Start Loading Part and Timing Information
---------------------------------------------------------------------------------
Loading part: xc7a200tsbg484-2
---------------------------------------------------------------------------------
Finished Loading Part and Timing Information : Time (s): cpu = 00:01:12 ; elapsed = 00:01:16 . Memory (MB): peak = 847.211 ; gain = 527.457
---------------------------------------------------------------------------------
---------------------------------------------------------------------------------
Start Applying 'set_property' XDC Constraints
---------------------------------------------------------------------------------
Applied set_property DONT_TOUCH = true for U0. (constraint file  D:/DATA/vivado_project/0TEST/minist_cnn/minist_cnn/minist_cnn.runs/fifo_generator_200_synth_1/dont_touch.xdc, line 9).
---------------------------------------------------------------------------------
Finished applying 'set_property' XDC Constraints : Time (s): cpu = 00:01:12 ; elapsed = 00:01:16 . Memory (MB): peak = 847.211 ; gain = 527.457
---------------------------------------------------------------------------------
---------------------------------------------------------------------------------
Finished RTL Optimization Phase 2 : Time (s): cpu = 00:01:13 ; elapsed = 00:01:16 . Memory (MB): peak = 847.211 ; gain = 527.457
---------------------------------------------------------------------------------

Report RTL Partitions: 
+-+--------------+------------+----------+
| |RTL Partition |Replication |Instances |
+-+--------------+------------+----------+
+-+--------------+------------+----------+
---------------------------------------------------------------------------------
Start RTL Component Statistics 
---------------------------------------------------------------------------------
Detailed RTL Component Info : 
+---Adders : 
	   2 Input      9 Bit       Adders := 1     
	   2 Input      8 Bit       Adders := 2     
+---XORs : 
	   2 Input      1 Bit         XORs := 32    
+---Registers : 
	                9 Bit    Registers := 1     
	                8 Bit    Registers := 4     
	                1 Bit    Registers := 7     
+---Muxes : 
	   2 Input      1 Bit        Muxes := 3     
---------------------------------------------------------------------------------
Finished RTL Component Statistics 
---------------------------------------------------------------------------------
---------------------------------------------------------------------------------
Start RTL Hierarchical Component Statistics 
---------------------------------------------------------------------------------
Hierarchical RTL Component report 
Module rd_bin_cntr 
Detailed RTL Component Info : 
+---Adders : 
	   2 Input      8 Bit       Adders := 1     
+---Registers : 
	                8 Bit    Registers := 2     
Module compare 
Detailed RTL Component Info : 
+---XORs : 
	   2 Input      1 Bit         XORs := 8     
Module rd_status_flags_ss 
Detailed RTL Component Info : 
+---Registers : 
	                1 Bit    Registers := 2     
+---Muxes : 
	   2 Input      1 Bit        Muxes := 1     
Module wr_bin_cntr 
Detailed RTL Component Info : 
+---Adders : 
	   2 Input      8 Bit       Adders := 1     
+---Registers : 
	                8 Bit    Registers := 2     
Module wr_status_flags_ss 
Detailed RTL Component Info : 
+---Registers : 
	                1 Bit    Registers := 2     
Module wr_pf_ss 
Detailed RTL Component Info : 
+---Adders : 
	   2 Input      9 Bit       Adders := 1     
+---Registers : 
	                9 Bit    Registers := 1     
	                1 Bit    Registers := 3     
+---Muxes : 
	   2 Input      1 Bit        Muxes := 2     
---------------------------------------------------------------------------------
Finished RTL Hierarchical Component Statistics
---------------------------------------------------------------------------------
---------------------------------------------------------------------------------
Start Part Resource Summary
---------------------------------------------------------------------------------
Part Resources:
DSPs: 740 (col length:100)
BRAMs: 730 (col length: RAMB18 100 RAMB36 50)
---------------------------------------------------------------------------------
Finished Part Resource Summary
---------------------------------------------------------------------------------
---------------------------------------------------------------------------------
Start Cross Boundary and Area Optimization
---------------------------------------------------------------------------------
Warning: Parallel synthesis criteria is not met 
---------------------------------------------------------------------------------
Finished Cross Boundary and Area Optimization : Time (s): cpu = 00:01:13 ; elapsed = 00:01:17 . Memory (MB): peak = 847.211 ; gain = 527.457
---------------------------------------------------------------------------------

Report RTL Partitions: 
+-+--------------+------------+----------+
| |RTL Partition |Replication |Instances |
+-+--------------+------------+----------+
+-+--------------+------------+----------+
---------------------------------------------------------------------------------
Start Applying XDC Timing Constraints
---------------------------------------------------------------------------------
---------------------------------------------------------------------------------
Finished Applying XDC Timing Constraints : Time (s): cpu = 00:01:22 ; elapsed = 00:01:26 . Memory (MB): peak = 864.094 ; gain = 544.340
---------------------------------------------------------------------------------
---------------------------------------------------------------------------------
Start Timing Optimization
---------------------------------------------------------------------------------
---------------------------------------------------------------------------------
Finished Timing Optimization : Time (s): cpu = 00:01:22 ; elapsed = 00:01:26 . Memory (MB): peak = 883.316 ; gain = 563.562
---------------------------------------------------------------------------------

Report RTL Partitions: 
+-+--------------+------------+----------+
| |RTL Partition |Replication |Instances |
+-+--------------+------------+----------+
+-+--------------+------------+----------+
---------------------------------------------------------------------------------
Start Technology Mapping
---------------------------------------------------------------------------------
---------------------------------------------------------------------------------
Finished Technology Mapping : Time (s): cpu = 00:01:22 ; elapsed = 00:01:26 . Memory (MB): peak = 883.316 ; gain = 563.562
---------------------------------------------------------------------------------

Report RTL Partitions: 
+-+--------------+------------+----------+
| |RTL Partition |Replication |Instances |
+-+--------------+------------+----------+
+-+--------------+------------+----------+
---------------------------------------------------------------------------------
Start IO Insertion
---------------------------------------------------------------------------------
---------------------------------------------------------------------------------
Start Flattening Before IO Insertion
---------------------------------------------------------------------------------
---------------------------------------------------------------------------------
Finished Flattening Before IO Insertion
---------------------------------------------------------------------------------
---------------------------------------------------------------------------------
Start Final Netlist Cleanup
---------------------------------------------------------------------------------
---------------------------------------------------------------------------------
Finished Final Netlist Cleanup
---------------------------------------------------------------------------------
---------------------------------------------------------------------------------
Finished IO Insertion : Time (s): cpu = 00:01:23 ; elapsed = 00:01:27 . Memory (MB): peak = 883.316 ; gain = 563.562
---------------------------------------------------------------------------------

Report Check Netlist: 
+------+------------------+-------+---------+-------+------------------+
|      |Item              |Errors |Warnings |Status |Description       |
+------+------------------+-------+---------+-------+------------------+
|1     |multi_driven_nets |      0|        0|Passed |Multi driven nets |
+------+------------------+-------+---------+-------+------------------+
---------------------------------------------------------------------------------
Start Renaming Generated Instances
---------------------------------------------------------------------------------
---------------------------------------------------------------------------------
Finished Renaming Generated Instances : Time (s): cpu = 00:01:23 ; elapsed = 00:01:27 . Memory (MB): peak = 883.316 ; gain = 563.562
---------------------------------------------------------------------------------

Report RTL Partitions: 
+-+--------------+------------+----------+
| |RTL Partition |Replication |Instances |
+-+--------------+------------+----------+
+-+--------------+------------+----------+
---------------------------------------------------------------------------------
Start Rebuilding User Hierarchy
---------------------------------------------------------------------------------
---------------------------------------------------------------------------------
Finished Rebuilding User Hierarchy : Time (s): cpu = 00:01:23 ; elapsed = 00:01:27 . Memory (MB): peak = 883.316 ; gain = 563.562
---------------------------------------------------------------------------------
---------------------------------------------------------------------------------
Start Renaming Generated Ports
---------------------------------------------------------------------------------
---------------------------------------------------------------------------------
Finished Renaming Generated Ports : Time (s): cpu = 00:01:23 ; elapsed = 00:01:27 . Memory (MB): peak = 883.316 ; gain = 563.562
---------------------------------------------------------------------------------
---------------------------------------------------------------------------------
Start Handling Custom Attributes
---------------------------------------------------------------------------------
---------------------------------------------------------------------------------
Finished Handling Custom Attributes : Time (s): cpu = 00:01:23 ; elapsed = 00:01:27 . Memory (MB): peak = 883.316 ; gain = 563.562
---------------------------------------------------------------------------------
---------------------------------------------------------------------------------
Start Renaming Generated Nets
---------------------------------------------------------------------------------
---------------------------------------------------------------------------------
Finished Renaming Generated Nets : Time (s): cpu = 00:01:23 ; elapsed = 00:01:27 . Memory (MB): peak = 883.316 ; gain = 563.562
---------------------------------------------------------------------------------
---------------------------------------------------------------------------------
Start Writing Synthesis Report
---------------------------------------------------------------------------------

Report BlackBoxes: 
+-+--------------+----------+
| |BlackBox name |Instances |
+-+--------------+----------+
+-+--------------+----------+

Report Cell Usage: 
+------+---------+------+
|      |Cell     |Count |
+------+---------+------+
|1     |CARRY4   |     2|
|2     |LUT1     |     4|
|3     |LUT2     |    15|
|4     |LUT3     |     3|
|5     |LUT4     |    16|
|6     |LUT5     |     6|
|7     |LUT6     |     8|
|8     |RAMB18E1 |     1|
|9     |FDRE     |    45|
|10    |FDSE     |     2|
+------+---------+------+

Report Instance Areas: 
+------+-------------------------------------------------------+-----------------------------+------+
|      |Instance                                               |Module                       |Cells |
+------+-------------------------------------------------------+-----------------------------+------+
|1     |top                                                    |                             |   102|
|2     |  U0                                                   |fifo_generator_v13_2_3       |   102|
|3     |    inst_fifo_gen                                      |fifo_generator_v13_2_3_synth |   102|
|4     |      \gconvfifo.rf                                    |fifo_generator_top           |   102|
|5     |        \grf.rf                                        |fifo_generator_ramfifo       |   102|
|6     |          \gntv_or_sync_fifo.gl0.rd                    |rd_logic                     |    53|
|7     |            \grss.rsts                                 |rd_status_flags_ss           |     6|
|8     |            rpntr                                      |rd_bin_cntr                  |    47|
|9     |          \gntv_or_sync_fifo.gl0.wr                    |wr_logic                     |    48|
|10    |            \gwss.gpf.wrpf                             |wr_pf_ss                     |    15|
|11    |            \gwss.wsts                                 |wr_status_flags_ss           |     6|
|12    |            wpntr                                      |wr_bin_cntr                  |    27|
|13    |          \gntv_or_sync_fifo.mem                       |memory                       |     1|
|14    |            \gbm.gbmg.gbmga.ngecc.bmg                  |blk_mem_gen_v8_4_2           |     1|
|15    |              inst_blk_mem_gen                         |blk_mem_gen_v8_4_2_synth     |     1|
|16    |                \gnbram.gnativebmg.native_blk_mem_gen  |blk_mem_gen_top              |     1|
|17    |                  \valid.cstr                          |blk_mem_gen_generic_cstr     |     1|
|18    |                    \ramloop[0].ram.r                  |blk_mem_gen_prim_width       |     1|
|19    |                      \prim_noinit.ram                 |blk_mem_gen_prim_wrapper     |     1|
+------+-------------------------------------------------------+-----------------------------+------+
---------------------------------------------------------------------------------
Finished Writing Synthesis Report : Time (s): cpu = 00:01:23 ; elapsed = 00:01:27 . Memory (MB): peak = 883.316 ; gain = 563.562
---------------------------------------------------------------------------------
Synthesis finished with 0 errors, 0 critical warnings and 463 warnings.
Synthesis Optimization Runtime : Time (s): cpu = 00:00:13 ; elapsed = 00:01:18 . Memory (MB): peak = 883.316 ; gain = 421.305
Synthesis Optimization Complete : Time (s): cpu = 00:01:23 ; elapsed = 00:01:27 . Memory (MB): peak = 883.316 ; gain = 563.562
INFO: [Project 1-571] Translating synthesized netlist
INFO: [Netlist 29-17] Analyzing 3 Unisim elements for replacement
INFO: [Netlist 29-28] Unisim Transformation completed in 0 CPU seconds
INFO: [Project 1-570] Preparing netlist for logic optimization
INFO: [Opt 31-138] Pushed 0 inverter(s) to 0 load pin(s).
Netlist sorting complete. Time (s): cpu = 00:00:00 ; elapsed = 00:00:00 . Memory (MB): peak = 892.172 ; gain = 0.000
INFO: [Project 1-111] Unisim Transformation Summary:
No Unisim elements were transformed.

INFO: [Common 17-83] Releasing license: Synthesis
17 Infos, 100 Warnings, 0 Critical Warnings and 0 Errors encountered.
synth_design completed successfully
synth_design: Time (s): cpu = 00:01:25 ; elapsed = 00:01:29 . Memory (MB): peak = 892.172 ; gain = 583.918
Netlist sorting complete. Time (s): cpu = 00:00:00 ; elapsed = 00:00:00 . Memory (MB): peak = 892.172 ; gain = 0.000
WARNING: [Constraints 18-5210] No constraints selected for write.
Resolution: This message can indicate that there are no constraints for the design, or it can indicate that the used_in flags are set such that the constraints are ignored. This later case is used when running synth_design to not write synthesis constraints to the resulting checkpoint. Instead, project constraints are read when the synthesized design is opened.
INFO: [Common 17-1381] The checkpoint 'D:/DATA/vivado_project/0TEST/minist_cnn/minist_cnn/minist_cnn.runs/fifo_generator_200_synth_1/fifo_generator_200.dcp' has been generated.
INFO: [Coretcl 2-1648] Added synthesis output to IP cache for IP fifo_generator_200, cache-ID = be56642a980b4931
INFO: [Coretcl 2-1174] Renamed 18 cell refs.
Netlist sorting complete. Time (s): cpu = 00:00:00 ; elapsed = 00:00:00 . Memory (MB): peak = 892.172 ; gain = 0.000
WARNING: [Constraints 18-5210] No constraints selected for write.
Resolution: This message can indicate that there are no constraints for the design, or it can indicate that the used_in flags are set such that the constraints are ignored. This later case is used when running synth_design to not write synthesis constraints to the resulting checkpoint. Instead, project constraints are read when the synthesized design is opened.
INFO: [Common 17-1381] The checkpoint 'D:/DATA/vivado_project/0TEST/minist_cnn/minist_cnn/minist_cnn.runs/fifo_generator_200_synth_1/fifo_generator_200.dcp' has been generated.
INFO: [runtcl-4] Executing : report_utilization -file fifo_generator_200_utilization_synth.rpt -pb fifo_generator_200_utilization_synth.pb
INFO: [Common 17-206] Exiting Vivado at Mon Jan 10 14:42:55 2022...
